Subject,Question,Answer
Mobilidade Acadêmica Nacional (Convênio ANDIFES) - Perguntas Frequentes,Onde posso encontrar as disciplinas ofertadas pela instituição de destino?,"Orientamos que busque essa informação no site da instituição de destino ou em contato direto com ela. É importante que, ao escolher a disciplina, seja observada a possibilidade de equivalência para posterior solicitação de aproveitamento de estudos. Na UnB a lista de oferta de disciplinas está disponível no SIGAA – Acesso Público: https://sigaa.unb.br/sigaa/public/turmas/listar.jsf?aba=p-ensino"
Mobilidade Acadêmica Nacional (Convênio ANDIFES) - Perguntas Frequentes,É possível ter o processo indeferido pela instituição de destino?,Sim. Cabe à instituição receptora analisar a documentação do estudante e de deferir ou indeferir o processo de mobilidade.
Mobilidade Acadêmica Nacional (Convênio ANDIFES) - Perguntas Frequentes,Posso escolher quantas disciplinas quiser estudar no semestre?,"A quantidade mínima e máxima de créditos em outras IFES fica a critério da análise da IFES receptora. Na UnB a Resolução CEG n° 001/2017, da UnB, institui que o(a) estudante curse o mínimo de 3 (três) disciplinas por semestre letivo."
Mobilidade Acadêmica Nacional (Convênio ANDIFES) - Perguntas Frequentes,Quantos semestres posso estudar em outra instituição?,"A Mobilidade Acadêmica nacional pode ser feita por um período de 2 (dois) semestres letivos, prorrogáveis, em caráter excepcional, por mais 1 (um) semestre."
Mobilidade Acadêmica Nacional (Convênio ANDIFES) - Perguntas Frequentes,Há algum auxílio financeiro para eu me mantenha em outro estado durante o período da Mobilidade?,"Não há nenhum suporte financeiro para estudantes de mobilidade nacional, por parte da UnB. Orientamos que busque saber se existe algum apoio dessa natureza na instituição de destino almejada."
Mobilidade Acadêmica Nacional (Convênio ANDIFES) - Perguntas Frequentes,"Após receber minha carta de aceite da instituição de destino, o que devo fazer?","Você deve seguir as instruções da instituição receptora e seu calendário acadêmico. Em geral, as cartas de aceite orientam o estudante, fornecendo dados de contato e períodos de matrícula."
Mobilidade Acadêmica Nacional (Convênio ANDIFES) - Perguntas Frequentes,"Posso manter o auxílio benefício (bolsa) que tenho na UnB, enquanto estudo em outra Universidade?","Não. Ao ser aprovado para a mobilidade o estudante tem sua matrícula trancada pelo período deferido, perdendo direito a qualquer auxílio que receba da UnB."
Mobilidade Acadêmica Nacional (Convênio ANDIFES) - Perguntas Frequentes,"Ao terminar a mobilidade, qual documento devo solicitar na IFES que me recebeu?",O estudante deve solicitar na instituição receptora um histórico escolar relativo ao período estudado.
Mobilidade Acadêmica Nacional (Convênio ANDIFES) - Perguntas Frequentes,Como regularizo minha situação na UnB ao retornar?,"O estudante, com o histórico emitido pela IFES receptora, deve solicitar aproveitamento de estudos à Secretaria de Administração Acadêmica: https://saa.unb.br/images/documentos/graduacao/peticionamento/Manual_Aproveitamento_de_Estudos_17_08_21.pdf"
Mobilidade Acadêmica Nacional (Convênio ANDIFES) - Perguntas Frequentes,"Caso eu desista de participar do programa de mobilidade, o que devo fazer? Serei prejudicado?","O estudante que desistir da participação no programa de mobilidade deve enviar um e-mail para Este endereço de email está sendo protegido de spambots. Você precisa do JavaScript ativado para vê-lo. informando a desistência. O estudante não será penalizado, e nem prejudicado, no entanto, orientamos que a desistência seja comunicada antes do início do semestre letivo."
Mobilidade Acadêmica Nacional (Convênio ANDIFES) - Perguntas Frequentes,"Em que site, telefones ou e-mails eu posso obter mais informações?",O contato conosco pode ser feito pelo e-mail mobilidadedaia@unb.br . Outras informações estão no site: http://deg.unb.br/mobilidade
Mobilidade Acadêmica Nacional (Convênio ANDIFES) - Perguntas Frequentes,Existe programa de mobilidade internacional?,"Sim. Para maiores informações, acesse: http://int.unb.br/br/ Contato: telefone - (61) 3107- 0265; e-mail - intweb@unb.br."
Mobilidade Acadêmica Nacional (Convênio ANDIFES) - Perguntas Frequentes,O Programa Promover/Andifes de mobilidade ainda existe?,"Não. O Programa de Mobilidade Virtual em Rede (Promover)/Andifes foi ofertado durante a pandemia do Covid-19 e tinha uma proposta diferente da mobilidade acadêmica nacional convencional, em especial, porque era no formato virtual."
Mobilidade Acadêmica Nacional (Convênio ANDIFES) - Perguntas Frequentes,"Após participar da Mobilidade Acadêmica, como posso solicitar aproveitamento de estudos?","Para solicitar esse aproveitamento, as etapas são:
Leia o Manual de Aproveitamento de Estudos disponível em https://saa.unb.br/images/documentos/graduacao/peticionamento/Manual_Aproveitamento_de_Estudos_17_08_21.pdf Solicite documento da instituição onde cursou a(s) disciplina(s) que comprove sua aprovação.
Com o histórico emitido pela IFES receptora, o(a) interessado(a) abre um peticionamento, no Sistema Eletrônico de Informação (SEI) da UnB, como orientado no Manual, anexa o(s) comprovantes de aprovação na(s) disciplina(s); No item 5 do formulário, no campo 'curso de origem' deve ser inserida a informação ""Edital 01/2021 - Promover Andifes"" ou .
A coordenação de curso emitirá um parecer conclusivo sobre quais componentes curriculares deverão ser aproveitados, se for o caso."
Monitoria - Perguntas Frequentes,O que é a monitoria de graduação?,"O programa de monitoria tem como objetivo promover a melhoria do ensino de graduação, através do estabelecimento de práticas e experiências pedagógicas que visem fortalecer a articulação entre teoria e prática, e a integração curricular em seus diferentes aspectos."
Monitoria - Perguntas Frequentes,Quem pode atuar como monitor?,Alunos regularmente matriculados nos cursos de graduação da Universidade de Brasília.
Monitoria - Perguntas Frequentes,Quais são os critérios para se candidatar à monitoria?,"1°- Ser aluno regularmente matriculado em curso de graduação da Universidade;
2°- Ter obtido aprovação na disciplina que pleiteia a monitoria, demonstrando domínio da mesma;
3°- Ter aprovação nos critérios adotados pelos professores responsáveis pela disciplina alvo da monitoria para a seleção dos interessados
4º- Ter disponibilidade de tempo para atender às atividades programadas;"
Monitoria - Perguntas Frequentes,Quero ser monitor. Onde e como posso realizar a minha inscrição?,"O processo seletivo de monitores é de responsabilidade de cada professor responsável pela disciplina alvo da monitoria. Os interessados devem procurar os professores, seja ao final do semestre ou no período de matrícula, a fim de se informar sobre quando e como ocorrerá a seleção de monitores."
Monitoria - Perguntas Frequentes,Como a atividade de Monitoria é registrada no Histórico Escolar?,"A atividade de Monitoria será registrada no SIGAA como componente curricular eletivo (módulo livre), com carga horária de 30 h."
Monitoria - Perguntas Frequentes,Posso ser monitor em mais de uma disciplina no mesmo semestre?,É vedado pelo que dispõe o art. 21 da Resolução CEPE 8/1990. Esta é a resolução vigente de Monitoria na UnB.
Monitoria - Perguntas Frequentes,Posso ser monitor mais de uma vez em uma mesma disciplina?,"Sim. Será possível cursar a atividade de monitoria por até 5 vezes em uma mesma disciplina. No entanto, vale ressaltar que por ser uma atividade eletiva, há um máximo de horas que serão computadas no histórico escolar, não sendo possível ultrapassar 360 horas de atividades eletivas em qualquer curso de graduação."
Monitoria - Perguntas Frequentes,Preciso de uma declaração de que fui monitor. Onde devo solicitar?,"Por ser um componente curricular com a denominação “Monitoria em...”, o próprio histórico Escolar servirá como comprovante da atividade de monitoria."
Monitoria - Perguntas Frequentes,Para quem devo informar a desistência da monitoria para a qual fui selecionado(a)?,"A desistência deve ser comunicada ao professor responsável pela disciplina alvo, para que seu nome seja enviado à Coordenação/Secretaria de Graduação, para a exclusão de sua matrícula na atividade de monitoria dentro do SIGAA."
Reintegração - Perguntas Frequentes,Até quando posso pedir reintegração?,Pode ser solicitada a qualquer tempo.
Reintegração - Perguntas Frequentes,Como fazer o pedido de reintegração?,"Faça sua solicitação de reintegração por meio de peticionamento eletrônico, seguindo as instruções do manual (link do manual), que explica o passo a passo para a solicitação de reintegração."
Reintegração - Perguntas Frequentes,"Meu processo foi indeferido, o que faço?",O manual (link do manual) também traz as explicações de como interpor um recurso.
Reintegração - Perguntas Frequentes,O que faz com que um aluno seja desligado?,"- Não cumprir quatro disciplinas do curso, com aproveitamento, em dois semestres consecutivos;- Exceder o limite do tempo de permanência (jubilamento);- Abandono (não ter registrado matrícula ou não ter obtido qualquer rendimento (menção SR) durante dois semestres consecutivos);- Reprovar 3 vezes a mesma disciplina obrigatória."
Módulo de Estágios no SIGAA - Perguntas Frequentes,"Tentei cadastrar uma empresa, e não encontrei no SIGAA, como proceder?","Neste caso há duas possibilidades:
a) É necessário verificar se essa empresa tem parceria com um agente de integração, conveniado à UnB, como por exemplo: CIEE, Agiel, Super Estágios, Universidade Patativa do Assaré, entre outras. Neste caso, a empresa que você deve informar no primeiro campo do pré cadastro é do agente integrador, conveniado à UnB.
b) Se a empresa não possuir agente de integração conveniado à UnB, ela precisará celebrar convênio com a UnB, se o estágio for na modalidade não obrigatório. Para isso, a empresa deve contactar o setor de convênios, através do e-mail: Este endereço de email está sendo protegido de spambots. Você precisa do JavaScript ativado para vê-lo.."
Módulo de Estágios no SIGAA - Perguntas Frequentes,Quando tento fazer o pré cadastro e não consigo preencher município e UF o que fazer?,Este caso deve ser reportado para a STI informando o CNPJ e nome da empresa completo para a correção no sistema.
Módulo de Estágios no SIGAA - Perguntas Frequentes,Cadastro do nome do supervisor está errado o que fazer?,Coordenação do Curso ou Secretaria de Curso poderá corrigir: clicar em ações - ALTERAR ESTÁGIO - CADASTRAR SUPERVISOR - ver o nome do supervisor e clicar na pastinha amarela ao final do nome e corrigir os dados - clicar em ALTERAR SUPERVISOR - VOLTAR e ir até o final da confirmação para alterar as informações.
Módulo de Estágios no SIGAA - Perguntas Frequentes,Percebi que o pdf inserido está errado o que fazer?,A Coordenação do Curso ou Secretaria de Curso poderá alterar inserir o pdf correto: clicar em ações - ALTERAR ESTÁGIO - no local de inserir o pdf clicar em ESCOLHER ARQUIVO - selecionar o arquivo correto e ir até o final da confirmação do processo para alterar as informações.
Módulo de Estágios no SIGAA - Perguntas Frequentes,"Preciso Aditar um Termo de Compromisso que não é alteração de período e sim mudança de supervisor, ou alteração da Bolsa de Estágio, ou alteração da apólice de seguro o que fazer?","Clicar em ADITAR ESTÁGIO, selecionar o(a) discente pela matrícula realizar o procedimento de aditamento conforme as informações contidas no manual. Colocar a data final contida no Termo Aditivo. Vai aparecer a MENSAGEM PADRÃO DO SISTEMA (não pode apagar esta mensagem). Clicar no botão ENTER e logo abaixo da mensagem padrão vai escrever o motivo do aditamento: MUDANÇA DE SUPERVISOR PARA: XXXX e/ou ALTERAÇÃO DE BOLSA PARA: XXXX e/ou MUDANÇA DA APÓLICE DE SEGURO PARA: XXXX."
Módulo de Estágios no SIGAA - Perguntas Frequentes,Cadastrei o nome do PROFESSOR ORIENTADOR errado o que fazer?,A Coordenação do Curso ou Secretaria de Curso poderá corrigir: clicar em ações - ALTERAR ESTÁGIO - Digitar o nome do Professor Orientador correto - selecionar - ir até o final da confirmação do processo para alterar as informações.
Módulo de Estágios no SIGAA - Perguntas Frequentes,"Não encontrei o professor orientador ou o supervisor cadastrado, o que fazer?",Reportar à secretaria de seu curso ou o coordenador do seu curso para que entrem em contato com a STI para solucionar o problema.
Retirada de Disciplinas - Perguntas Frequentes,O que é retirada de disciplinas?,"A retirada de disciplinas é uma ferramenta disponível, normalmente, durante o período de matrícula e que permite ao estudante retirar a disciplina do seu currículo, ou seja, após realizado o processo, a disciplina deixa de aparecer no histórico do estudante. Assim, esse é um recurso adequado para o período de matrícula, em que são esperadas alterações nas grades dos estudantes."
Retirada de Disciplinas - Perguntas Frequentes,Qual a diferença de retirada de disciplinas para trancamento de disciplinas?,"Em um contexto normal, após a finalização do período de matrículas, o estudante, caso deseje deixar de cursar uma disciplina, precisa trancá-la e pode fazê-lo até 50% do semestre. Nesse processo, o estudante passa a não estar mais matriculado, mas o trancamento fica registrado no histórico escolar, diferente do que acontece na retirada, em que a disciplina retirada não consta mais no histórico."
Retirada de Disciplinas - Perguntas Frequentes,O que mudou no processo de retirada de disciplinas durante o ensino remoto?,"Durante a vigência do ensino remoto, em função da pandemia da Covid-19, o recurso de retirada tem sido flexibilizado pelas resoluções do CEPE, que a cada início de semestre tem se reunido para decidir sobre o planejamento e a execução de atividades de ensino‒aprendizagem e de extensão durante a pandemia. Desse modo, a retirada tem sido permitida até o último dia do semestre. Assim, também, tem sido definido que enquanto as atividades de graduação permanecerem de forma não presencial, não haverá trancamento de disciplinas, uma vez que elas poderão ser retiradas até o último dia de aula, sendo esse o recurso mais benéfico aos estudantes."
Retirada de Disciplinas - Perguntas Frequentes,A retirada pode prejudicar em algum momento da vida universitária?,"Em termos técnicos, não. Nem a retirada, nem o trancamento de disciplina causam impacto no IRA do estudante. A diferença entre os dois recursos, como dito anteriormente, é que, durante o ensino regular (antes da Pandemia de Covid-19) a disciplina trancada fica registrada no histórico do estudante com o status de trancada. Já a retirada de disciplina não deixa nenhum registro no histórico, isso porque este recurso é utilizado normalmente para o período de matrícula. O recurso do trancamento pode ser usado depois de decorrido 50% do semestre. Agora, com o ensino remoto, pode-se usar apenas a retirada ao longo de todo o semestre, o que significa uma flexibilização mais vantajosa para o estudante."
Retirada de Disciplinas - Perguntas Frequentes,"OK, em termos técnicos a retirada não prejudica o estudante, mas pode haver algum outro prejuízo?","Sim. Principalmente se esse recurso for usado pelo estudante de maneira não refletida. Em termos pessoais, o estudante pode sair do fluxo e atrasar sua formatura. Institucionalmente falando, a retirada excessiva de disciplinas tem causado represamento dos estudantes nos fluxos, de maneira que a oferta de vagas tem ficado cada vez mais concorrida. A UnB trabalha arduamente para oferecer soluções aos problemas que vêm surgindo, inclusive em relação ao problema do represamento. Mas é importante também que o estudante use o recurso do trancamento — que a instituição tem oferecido aos estudantes como uma ferramenta mais vantajosa — de maneira eficiente e refletida."
Retirada de Disciplinas - Perguntas Frequentes,Posso retirar a disciplina e depois desistir da retirada?,"Não. Isso porque o procedimento é automático no Sigaa. O estudante realiza a retirada diretamente no sistema, logado com seu perfil de estudante. Dessa maneira, a responsabilidade por essa operação é do estudante e não há no sistema nenhum recurso que permita reverter o trancamento."
Retirada de Disciplinas - Perguntas Frequentes,E se eu retirar a única disciplina em que estou matriculado?,"Caso o aluno venha a trancar a última ou a única disciplina ativa na matrícula do semestre, automaticamente será lançado, no seu histórico escolar, o trancamento geral justificado, a fim de que não haja prejuízos para sua vida acadêmica."
Retirada de Disciplinas - Perguntas Frequentes,Qual é o procedimento para a retirada de disciplina?,"Para o semestre de 2021/1, os estudantes podem realizar a retirada de disciplinas diretamente no SIGAA até o dia 6/11/2021, na opção Retirar Matrícula. Basta selecionar a disciplina e clicar em Retirar Disciplina. Para finalizar a operação, basta inserir os dados pessoais requeridos pelo sistema e clicar em Confirmar Retirada. Mas lembre-se: após finalizado o processo não será possível reverter a retirada."
