Subject,Question,Answer
Estágio - Perguntas sobre Convênios,Quando posso emitir o TCE?,"O Termo de Compromisso de Estágio só poderá ser emitido após o convênio se tornar vigente. O estágio só poderá iniciar, após assinatura do TCE por todas as partes."
Estágio - Perguntas sobre Convênios,Para onde devo enviar o TCE?,O TCE deverá ser enviado para o e-mail da Coordenação do Curso do estudante. Eles iniciarão o processo no SEI.
Estágio - Perguntas sobre Convênios,Onde posso encontrar o endereço de e-mail das Coordenações dos Cursos?,"Acessando o link: http://noticias.unb.br/images/Telefones_unb/mprazer.pdf, ou diretamente com estudante interessado."
Estágio Supervisionado das Licenciaturas - Perguntas Frequentes,O que é o estágio?,"Estágio é o ato educativo escolar supervisionado, desenvolvido no ambiente de trabalho, que visa à preparação para o trabalho produtivo de educandos que estejam frequentando o ensino regular em instituições de educação superior, de educação profissional, de ensino médio, da educação especial e dos anos finais do ensino fundamental, na modalidade profissional da educação de jovens e adultos. (Art. 1º da Lei nº 11.788/2008)."
Estágio Supervisionado das Licenciaturas - Perguntas Frequentes,Qual a importância do estágio?,"É etapa obrigatória e essencial para a qualificação plena do licenciando. Por meio dessa vivência no campo de trabalho, é que se começa a adquirir a dimensão da realidade educacional, com orientação que o aluno tem oportunidade de entrar em contato direto com a sua futura realidade profissional, vivenciando na prática supervisionada experiências e situações reais da vida e do trabalho, permitindo a consolidação dos conteúdos e conceitos teóricos já aprendidos em sala de aula."
Estágio Supervisionado das Licenciaturas - Perguntas Frequentes,Quais são as normas que regulamentam os estágios supervisionados?,"Há quatro documentos que devem ser observados em relação ao Estágio Supervisionado: a) No âmbito Federal, a Lei Federal nº 11.788/2008; b) No âmbito da UnB, a Resolução 104/2021 do CEPE; c) No âmbito pedagógico, as DCNs dos Cursos; d) No âmbito dos Cursos, os Projetos Político Pedagógicos do Curso.
 
1.4.1 Página com vídeos e links úteis:DEG - Estágios Obrigatórios das Licenciaturas"
Estágio Supervisionado das Licenciaturas - Perguntas Frequentes,As disciplinas de estágio podem receber outra denominação nos Cursos da UnB?,"Não. De acordo com a Resolução do Conselho de Ensino Pesquisa e Extensão da UnB nº 104/2021, as disciplinas de Estágio Obrigatório devem ser nomeadas como ESTÁGIO."
Estágio Supervisionado das Licenciaturas - Perguntas Frequentes,Quais requisitos devem ser observados na concessão do estágio e documentos necessários à comprovação da regularidade do estágio?,"O estágio não cria vínculo empregatício de qualquer natureza, mas devem ser observados os seguintes requisitos:
Matrícula e frequência regular do educando, atestados pela instituição de ensino;
Solicitação prévia de matrícula na disciplina de estágio, no caso de estágio obrigatório;"
Estágio Supervisionado das Licenciaturas - Perguntas Frequentes,Pode ocorrer estágio durante o período de trancamento do curso?,"Não pode ocorrer o estágio no caso de trancamento ou integralização do curso, uma vez que um dos requisitos para realização do estágio é a matrícula e a frequência regular do educando. Bem assim, o aluno só poderá permanecer no estágio enquanto estiver devidamente matriculado na UnB, ou seja, enquanto estiver ativo no SIGAA."
Estágio Supervisionado das Licenciaturas - Perguntas Frequentes,Pode-se iniciar o estágio sem a documentação (Termo de compromisso e Plano de atividades) assinada pelos envolvidos?,"Não. O Termo de Compromisso é o único documento que comprova legalmente a relação de estágio, portanto o estágio só poderá ser iniciado com a assinatura do Termo de Compromisso e do Plano de Atividades."
Estágio Supervisionado das Licenciaturas - Perguntas Frequentes,Qual a duração permitida para a jornada de estágio?,"Segundo o Art. 10º da Resolução 104/2021 do CEPE a carga horária das atividades de Estágio será definida em comum acordo entre a Instituição de Ensino, a parte concedente e o(a) Estagiário(a), não podendo ultrapassar o total de 30 (trinta) horas semanais, considerando o somatório de Estágios Obrigatórios e Não Obrigatórios realizados simultaneamente.
§1º O(A) Estudante poderá, excepcionalmente, cumprir jornada de Estágio superior a 30 (trinta) horas semanais, não mais que 40 (quarenta) horas, resguardados os limites e requisitos legais, desde que não esteja cursando componentes curriculares presenciais obrigatórios, optativos e/ou módulo livre nos horários dedicados às atividades de Estágio.
Essa condição, necessariamente, deve estar prevista no Projeto Pedagógico do Curso."
Estágio Supervisionado das Licenciaturas - Perguntas Frequentes,O estagiário tem direito ao seguro contra acidentes pessoais?,"Sim. Todo estagiário tem que ter Seguro Contra Acidentes Pessoais; Consoante previsto no art. 9o, inc. IV, da Lei 11.788/2008. Todos os estagiários da UnB estão assegurados. Para a consulta do modelo da apólice, acesse o link: http://deg.unb.br."
Estágio Supervisionado das Licenciaturas - Perguntas Frequentes,Os estágios devem ser presenciais?,"As condições de realização do estágio são acordadas entre o professor supervisor da UnB, o estudante e o professor da escola.
No caso específico da Secretaria de Educação do DF, os estágios supervisionados de licenciatura na SEEDF são realizados de forma presencial. Em casos especiais, como no caso da pandemia de Covid-19, podem ocorrer alterações na forma de realização dos estágios, mas, para que isso ocorra,deve haver celebração de um Termo Aditivo no convênio realizado entre a SEEDF e a UnB."
Estágio Supervisionado das Licenciaturas - Perguntas Frequentes,"Quais são as três etapas dos estágios, às quais devo prestar mais atenção?","Há três momentos importantes na realização dos estágios supervisionados:
a) O início do estágio: etapa onde o docente da UnB irá orientar os estagiários sobre os objetivos pedagógicos da disciplina e irá orientar os ""estudantes"" a encontrarem um local para realização de estágio e a preencher a documentação necessária; Preenchimento da documentação de estágio. b) A realização do estágio na escola: nessa etapa o estudante irá a campo para vivenciar sua experiência de estágio supervisionado, sempre acompanhado do professor supervisor da escola;É recomendável que o estudante leve uma carta de recomendação do professor da UnB e que haja constante diálogo entre os docentes e o estagiário.
c) Finalização do estágio: a finalização do estágio também deve obedecer a requisitos pedagógicos e legais.Por ser caracterizado como atividade de caráter pedagógico, o estagiário deverá preparar os relatórios acordados com o professor da UnB.Na parte legal, o estagiário deverá entregar o Relatório de Conclusão de estágio e postá-lo no SIGAA."
Estágio Supervisionado das Licenciaturas - Perguntas Frequentes,Quais são as competências de cada parte do estágio?,"Competências no estágio supervisionado
Os procedimentos explicitados abaixo devem ser observados como orientações importantes para que se estabeleça entre os atores envolvidos uma relação de confiança mútua e respeito.
Ressalta-se que, prioritariamente, o Estágio deverá ocorrer nas escolas públicas, em salas de aulas, focando toda atenção a docência, buscando atender aos diferentes interesses dos nossos discentes, que poderão se voltar também para a educação não- formal, (educação essa que vem cumprindo papel importante na minimização das desigualdades sociais de nosso país), sem perder de vista a escola pública como principal espaço de formação do licenciado.
 
Ao estagiário compete:
 
a) Observar a estrutura, funcionamento, recursos e clientela da escola na qual realiza o estágio; b) Observar a atuação didático-pedagógica do professor regente da classe em que está estagiando;
c) Participar das aulas, atuando em atividades de ensino sugeridas e/ou autorizadas pelo professor regente de classe;
d) Executar regência de classe, ministrando aulas na classe em que está estagiando;
e) Desenvolver atividades extra-classe, que correspondem ao planejamento e programação do estágio, de acordo com a orientação do professor supervisor; f) Participar em atividades de gestão;
g) Presentar relatório final ao professor orientador, em data marcada pela coordenação de estágio, contemplando no mínimo: referencial teórico; bibliografia consultada; estratégias; descrição e avaliação das atividades específicas do estágio; observações gerais; cópias dos planos, unidades de aulas, dos exercícios propostos e modelos dos materiais utilizados; o acadêmico, ao invés de apresentar relatório, pode optar pela elaboração de um trabalho de pesquisa, com base nas suas experiências de estágio e participação nas atividades de ensino.
 
Ao professor orientador (UnB) compete
 
a) Orientar o estagiário em relação à carga horária, ao contexto de atuação e à documentação do estágio;
b) Orientar o estagiário em relação a elaboração das atividades a serem desenvolvidas no campo do estágio; c) Monitorar o andamento do estágio; d) Acompanhar os licenciandos em suas atividades em campo; e) Manter comunicação com o professor supervisor da escola responsável direto pelo estagiário;
f) Propor atividades de estudo que permitam ao estagiário a reflexão crítica da relação teoria prática da atividade docente;
g) Propor atividades de estudo que ocasionem ao estagiário conhecer os problemas da educação e sua superação.
h) Promover reflexões acerca da prática profissional relacionada às atividades do Estagiário;
i) Proceder ao encaminhamento formal de Estudantes ao local de Estágio, orientando sobre os mecanismos, as etapas e as atividades correspondentes;
j) Orientar o(a) Estagiário(a) na formulação do Plano de Atividades e documentos correlatos.
 
Ao professor supervisor da escola compete
 
a) Receber o estagiário e proporcionar condições de observação, regência e acesso à informação sobre a escola;
b) Avaliar o desempenho do estagiário em relação a aspectos como responsabilidade, relação com os alunos, relação com os profissionais da escola, desempenho nas atividades propostas;
c) Acompanhar presencialmente as atividades de regência dos estagiários;
d) Elaborar, em conjunto com o(a) Estagiário(a) e o(a) Professor(a) Orientador(a), o Plano de Atividades do Estágio;
e) Cumprir e fazer cumprir o Plano de Atividades e a sua programação; f) Inserir o(a) Estagiário(a) na instituição concedente, orientando-o(a) quanto às normas do local, além de acompanhar e avaliar o desempenho em suas atividades no serviço; g) Acompanhar a frequência do(a)Estagiário(a) nas atividades;
h) Preencher e encaminhar os formulários de avaliação de desempenho do(a) Estagiário(a);
 
2. Informações sobre a documentação do estágio"
Estágio Supervisionado das Licenciaturas - Perguntas Frequentes,O que é o Termo de Compromisso (TCE) e qual sua importância?,"É um contrato de estágio celebrado entre o discente ou seu representante legal, a parte concedente do estágio e UnB. Segundo o Art 11º da Lei de estágio, Estágios não pressupõem vínculo empregatício de qualquer natureza, porém, é compulsória a celebração do TCE entre o Estudante (ou seu representante ou assistente legal), a Instituição Concedente e a Instituição de Ensino, prevendo as condições de realização do Estágio."
Estágio Supervisionado das Licenciaturas - Perguntas Frequentes,Como preencher as informações do período de estágio no TCE?,"O período de estágio deve ser preenchido respeitando como data de início uma semana após o início das aulas letivas do Calendário da SEEDF e data final NO MÁXIMO o último dia letivo do semestre da UnB.
Importante: Organize-se para colher TODAS as assinaturas antes de iniciar as atividades de estágio na escola."
Estágio Supervisionado das Licenciaturas - Perguntas Frequentes,Como preencher informações sobre o intervalo no termo de estágio?,Não é necessário especificar o tempo do intervalo no TCE.
Estágio Supervisionado das Licenciaturas - Perguntas Frequentes,Quem assina o TCE para o estágio na SEEDF?,• Estudante; • Professor/Coordenador/Orientador de Estágio na IES; • Concedente (CRE);
Estágio Supervisionado das Licenciaturas - Perguntas Frequentes,O que fazer se a Regional de Ensino da SEEDF (CRE) demorar para assinar o TCE?,Entrar em contato com o responsável na CRE e verificar o motivo da demora.
Estágio Supervisionado das Licenciaturas - Perguntas Frequentes,Como conseguir os contatos dos coordenadores das CREs?,Os contatos dos coordenadores das CREs são disponibilizados semestralmente pela equipe da DAPLI ou por solicitação no e- mail: cildeg@ unb.br
Estágio Supervisionado das Licenciaturas - Perguntas Frequentes,"No caso de estágio em escolas que não pertençam à SEEDF, qual modelo de Termo de Compromisso (TCE) usar?","Segundo consta no §3º do Art. 11º da Resolução de Estágio da UnB, o Termo de Compromisso deverá seguir preferencialmente o padrão estabelecido pelo DEG (consultar a página do Decanato de Ensino de Graduação http:// deg.unb.br).
A assinatura do TCE será realizada pelo Estagiário(a); pelo(a) Professor(a) da UnB; pelo professor supervisor da escola e pela Concedente."
Estágio Supervisionado das Licenciaturas - Perguntas Frequentes,Como disponibilizar assinatura externa?,"Para uma explicação mais detalhada sobre a disponibilização de assinaturas externas, acesse: https://youtu.be/ysU45BaHt_Y"
Estágio Supervisionado das Licenciaturas - Perguntas Frequentes,É possível iniciar os estágios sem todas as assinaturas no Termo de Compromisso?,"O estágio NÃO poderá ser realizado antes de se obter todas as assinaturas no processo TCE.De acordo com a Resolução Cepe, não será admitida a assinatura retroativa de TCEs."
Estágio Supervisionado das Licenciaturas - Perguntas Frequentes,No caso de estágio em escolas particulares ou outras redes SEEDF a documentação muda?,"A documentação para todos os demais estágios é a padrão da UnB e está disponível em: http://deg.unb.br/regras-de-estagio
O estágio NÃO poderá ser realizado antes de se obter todas as assinaturas no processo e, de acordo com a Resolução Cepe, não será admitida a assinatura retroativa de TCEs.
Em casos de projetos especiais para Estágios, tais como projetos de extensão, o próprio professor da UnB pode ser o professor supervisor e professor orientador de estágio? Sim. Em casos especiais, o próprio professor da UnB pode ser o professor supervisor e professor orientador de estágio desde que o professor insira seu nome nesses dois campos presentes no TCE."
Estágio Supervisionado das Licenciaturas - Perguntas Frequentes,E sobre a carga horária constante no Termo de compromisso?,"É importante que estejam no Plano de Atividades apenas as horas destinadas às atividades presenciais na escola. Momentos de preparação pedagógica para o estágio não devem ser inseridos. Exemplo: O Estágio Supervisionado no Ensino Médio do Curso X possui carga horária de 150h/a, organizadas da seguinte forma:
Orientação – 30h; Planejamento – 3h; Observação – 5h; Regência – 40h; Elaboração de relatório e preparação para a mostra – 30h; Socialização (roda de conversa e pôster) – 10h; Mostra de estágios – 5h No TCE, só deve ser inserida a carga horária de observação (5h) e regência (40h), já que são essas as atividades que serão realizadas na escola."
Estágio Supervisionado das Licenciaturas - Perguntas Frequentes,Quais os procedimentos legais para finalização do estágio obrigatório?,"Conforme previsto na Resolução nº 104/ 2021 do CEPE em seu artigo 3º, ao final do Estágio o Estudante deverá obrigatoriamente entregar a declaração ou certificado de conclusão de estágio e o relatório de atividade do estágio, esses documentos devem conter três assinaturas: Estudante estagiário, Professor(a) Orientador(a) da UnB e Supervisor(a) da Escola. (Ver Modelo no Anexo 1)"
Estágio Supervisionado das Licenciaturas - Perguntas Frequentes,Quem deve manter os documentos de finalização do estágio?,"Os documentos de finalização do estágio devem ser mantidos pelos professores responsáveis pelos estágios na UnB, como comprovação da realização do estágio.Estes documentos podem ser anexados ao Processo SEI de cada estudante estagiário Todos os registros dos TCEs assinados e os relatórios finais deverão ser arquivados pela Coordenação do Curso de Graduação.
 
4. Entre as ações desenvolvidas pela DAPLI/CIL e membros da Comissão de Estágio para orientar professores e estudantes na realização do estágio, estão as seguintes:
a) Manutenção da Comissão Central de Estágio das Licenciaturas (CCEL): Comissão que se reúne mensalmente e planeja diversas ações para garantir a qualidade nas ações de Estágio no âmbito das Licenciaturas da UnB. É uma reunião aberta a todos os professores e técnicos que lidam com o Estágio das Licenciaturas.
b) Elaboração de Orientações Pedagógicas: Documentação elaborada por professores da CCEL para orientar a realização dos estágios supervisionados.
c) Repositório on-line de informações na página: http://deg.unb.br/ licenciaturas.
e) Convênio de Estágios em escolas em escolas públicas e privadas fora do Distrito Federal:
Não é necessário firmar convênio quando o Estágio for obrigatório, sem contraprestação de bolsa, independente de serem públicas ou privadas, no DF ou fora.Somente é necessário o convênio quando o estágio for obrigatório com contraprestação de bolsa ou Estágio não obrigatório.
 
5. Para os professores da UnB:
Mantenha o diálogo com o representante da sua unidade na Comissão de Estágio da DAPLI;Busque conhecer os professores da educação básica que estão dispostos a receber estagiários;Procure ir ao campo de estágio pelo menos duas vezes durante o semestre;Envie mensagem de apresentação para todos os professores que receberão seus estagiários (sugestão de carta Anexo 2); Planeje as atividades juntamente com os professores supervisores da escola;Dialogue com os professores sobre os objetivos do estágio supervisionado e critérios de avaliação;Auxilie seus colegas de unidade nas orientações de estágio, principalmente se esse professor for novo na disciplina.
 
Atenção: Os/as estudantes poderão iniciar os estágios a partir do 1º dia letivo do semestre.
 
Em caso de dúvidas, entre em contato por e-mail à Este endereço de email está sendo protegido de spambots. Você precisa do JavaScript ativado para vê-lo.."
Matrícula - Perguntas Frequentes,"Sou calouro, preciso fazer a matrícula no SIGAA?","A matrícula nas disciplinas dos calouros é realizada automaticamente pela SAA, ou seja, não é necessário que o calouro monte sua grade horária no primeiro semestre do curso, pois ele começará o primeiro semestre automaticamente matriculado em todas as disciplinas da grade do primeiro semestre do seu curso.
 
Então, durante todo o período de solicitação de matrícula pelos estudantes o calouro não precisará se preocupar com sua matrícula em disciplinas, pois após o registro haverá a matrícula automática e o calouro poderá conferir, no SIGAA, a sua grade com matrículas nas disciplinas do primeiro semestre efetivadas."
Matrícula - Perguntas Frequentes,Onde confiro o calendário para o semestre de 2021.2?,"A Secretaria de Administração Acadêmica (SAA) é a responsável pelos Calendário de Matrícula em Disciplina e Calendário por Atividades. Vale a pena sempre conferir as datas pela página dos calendários de Graduação no site da SAA, pois eles sempre estarão atualizados (inclusive com a indicação da última atualização). Ou seja, o seguro, é sempre conferir as datas por lá."
Matrícula - Perguntas Frequentes,Onde eu acho os códigos das disciplinas? Onde eu posso achar a oferta?,"No Portal Público do SIGAA é possível pesquisar as disciplinas, por meio da opção Componentes Curriculares, selecionando a unidade responsável pela oferta. Desse modo, você pode consultar a lista de oferta antes do período de matrícula, o que ajuda no planejamento da matrícula. Na aba Estudante é possível acessar a tabela de correspondência entre os códigos de disciplinas utilizados no SIGRA e os códigos do SIGAA."
Matrícula - Perguntas Frequentes,Como eu consigo ver as reservas específicas de cada disciplina?,"Durante o período de matrícula, por meio do Portal do estudante no SIGAA, é possível acessar cada turma dos componentes curriculares e verificar a reserva de vagas daquela turma, bem como outros detalhes, como se sua matrícula é permitida naquele componente, se há reserva de vagas para matrizes curriculares específicas além de outros detalhes."
Mobilidade Acadêmica Nacional (Convênio ANDIFES) - Perguntas Frequentes,O que é Mobilidade Acadêmica?,Trata-se de um convênio firmado entre as diversas Instituições Federais de Ensino Superior (IFES) que permite a mobilidade de estudantes de graduação entre as conveniadas.
Mobilidade Acadêmica Nacional (Convênio ANDIFES) - Perguntas Frequentes,Onde encontro a lista de IFES conveniadas?,"Somente estão conveniadas, no momento, as instituições federais de ensino superior. A lista completa e atualizada pode ser encontrada nos sites do DEG e Andifes."
Mobilidade Acadêmica Nacional (Convênio ANDIFES) - Perguntas Frequentes,Quem pode participar?,"Podem participar da mobilidade acadêmica nacional os estudantes com matrícula ativa e regular em cursos de graduação das instituições conveniadas, que atendam aos requisitos descritos no item 8 deste Pergunta Frequentes."
Mobilidade Acadêmica Nacional (Convênio ANDIFES) - Perguntas Frequentes,Posso perder minha vaga na UnB ao participar da mobilidade?,"Não. O(A) estudante não perde a vaga, pois ele(a) terá a sua matrícula trancada na UnB ou nas demais instituições. Ao retornar do programa de mobilidade, a matrícula será reativada."
Mobilidade Acadêmica Nacional (Convênio ANDIFES) - Perguntas Frequentes,Posso me candidatar a qualquer tempo?,"Não. Existe um calendário nacional Andifes que orienta todo o processo, mas as IFES têm autonomia para indicar outros prazos. Consulte sempre o calendário acadêmico da instituição onde você deseja cursar."
Mobilidade Acadêmica Nacional (Convênio ANDIFES) - Perguntas Frequentes,Qual o período de inscrição na mobilidade acadêmica na UnB?,"De acordo com o calendário nacional Andifes, as instituições conveniadas definem o período de inscrição em seu calendário, a cada semestre. Para saber os prazos da UnB, busque essa informação na página do DEG: DEG / DAIA Mobilidade Acadêmica nacional"
Mobilidade Acadêmica Nacional (Convênio ANDIFES) - Perguntas Frequentes,"O que poderei fazer, se o período de inscrição na mobilidade acadêmica na instituição que pretendo ir for diferente do período da UnB?","Para que o pedido de mobilidade tramite é necessário que tanto a instituição de origem quanto a receptora estejam com prazos de inscrição abertos. Por essa razão, orientamos que o(a) candidato(a) busque essa informação no site da instituição de destino/receptora ou em contato direto com ela. Em caso de divergência de períodos, a solicitação não será analisada."
Mobilidade Acadêmica Nacional (Convênio ANDIFES) - Perguntas Frequentes,Quais os requisitos para participar da mobilidade?,"Os requisitos para solicitar a mobilidade acadêmica pelo Convênio Andifes são: a) estar matriculado em curso de graduação em instituição conveniada; b) ter concluído, no ato da solicitação, pelo menos vinte por cento da carga horária de integralização do curso; c) ter no máximo duas reprovações acumuladas nos dois períodos letivos que antecedem o pedido de mobilidade; d) não estar, no ato da solicitação, usufruindo de nenhuma modalidade de trancamento de matrícula."
Mobilidade Acadêmica Nacional (Convênio ANDIFES) - Perguntas Frequentes,Onde inicio o processo de mobilidade?,"A solicitação de mobilidade acadêmica sempre ocorre pelo estudante com a coordenação de seu curso de origem, que o orientará acerca, principalmente, sobre a equivalência das disciplinas pleiteadas. Se for estudante de Outras IFES o processo com a documentação, assinado pelo(a) estudante e coordenação de curso ou equivalente, deverá ser encaminhado pelo e-mail Este endereço de email está sendo protegido de spambots. Você precisa do JavaScript ativado para vê-lo. . Se for estudante da UnB, o processo com a documentação, assinado pelo(a) estudante e coordenação de curso, deverá ser encaminhado para SEI, ambiente DEG/DAIA/MOBI."
Mobilidade Acadêmica Nacional (Convênio ANDIFES) - Perguntas Frequentes,Quais documentos devo apresentar para solicitar a mobilidade?,"Além dos documentos solicitados pela Instituição de destino, o estudante deverá anexar ao processo a) cópia RG e CPF; b) declaração que o aluno está regularmente matriculado em disciplinas; c) cópia do histórico escolar de graduação; d) requerimento de participação no programa de mobilidade, disponível no link: http://deg.unb.br/mobilidade. No requerimento deverá constar o(s) semestre(s) letivo(s) e as disciplinas a serem cursadas."
