Subject,Question,Answer
Informações Complementares,"Diplomas de outras Instituições de Ensino Enviei toda documentação à faculdade (privada), mas, até agora, ela não entregou o diploma. Posso entregar a documentação diretamente à UnB? ",Não é possível. O contato da UnB é exclusivo com a IES.
Informações Complementares,"Diplomas de outras Instituições de Ensino Fui aprovado em um concurso público e preciso, com urgência, do diploma. O que devo fazer?","Você deve entrar em contato com a IES e fazer o pedido de emissão do diploma em caráter de urgência. A urgência para registro do diploma deve ser solicitada pela IES, mediante as comprovações da urgência."
Informações Complementares,Diplomas de outras Instituições de Ensino Qual prazo a UnB tem para registrar o diploma? ,"Conforme o art. 19, §2º, da Portaria MEC nº 1.095/2018, a IES registradora deverá registrar o diploma no prazo máximo de sessenta dias, contados do recebimento do diploma procedente de IES expedidora.O prazo poderá ser prorrogado uma única vez, por igual período, desde que devidamente justificado pela IES."
Informações Complementares,Diplomas de outras Instituições de Ensino A UnB expede o diploma da IES das Faculdades particulares? ,"Não. Conforme o art. 3º, da Portaria MEC nº 1.095/2018, os diplomas expedidos pelas universidades serão por elas próprias registrados. Já os diplomas conferidos por instituições não universitárias serão registrados por universidades credenciadas, na forma da legislação vigente, à exceção das Faculdades Caiçaras, Garcia Silveira e da Faculdade da Terra de Brasília."
Informações Complementares,Diplomas de outras Instituições de Ensino Como saber se meu diploma realmente foi registrado pela UnB? ,O titular do diploma deve enviar cópia dos seguintes documentos:
Informações Complementares,Restaurante Universitário (RU) Como faço para não pagar o RU? ,Confira as condições de isenção no site da DDS (Diretoria de Desenvolvimento Social): http://dds.dac.unb.br/index.php/perguntas-frequentes.
Informações Complementares,"Restaurante Universitário (RU) Como faço para conhecer, virtualmente, o cardápio do RU? ",Para conhecer o cardápio acessar o link do restaurante em: https://ru.unb.br/index.php/cardapio-ru.
Informações Complementares,Peticionamento Eletrônico Como o aluno consegue acessar o sistema? ,"Para acesso ao sistema, é necessário fazer cadastro por meio do seguinte link: SEI - Sistema Eletrônico de Informações - Início (unb.br)Caminho: SEI! --> Usuário Externo e Aluno / Esqueci a senhaTodos os alunos da UnB já possuem um pré-cadastro. Caso não seja aluno, deve fazer um cadastro e solicitar a liberação ao e-mailsaaatendimento@unb.br."
Informações Complementares,Peticionamento Eletrônico O que é peticionamento eletrônico? ,"Trata-se de um mecanismo eletrônico, dentro da plataforma SEI/UnB, para que usuários externos da universidade possam acessar processos e demandas (demandas as quais que estão discriminadas dentro da plataforma)."
Informações Complementares,Peticionamento Eletrônico Para que serve o cadastro no SEI? ,O SEI serve para fazer algumas solicitações por peticionamento eletrônico e para acompanhar processos em que o aluno é o interessado.
Informações Complementares,Peticionamento Eletrônico Quem são os usuários externos? ,São pessoas que não pertencem ao quadro de servidores da UnB.
Informações Complementares,Peticionamento Eletrônico O que significa a expressão “processo sobrestado” no SEI? ,"O sobrestamento de processos corresponde à suspensão temporária do processo, inclusive interrompendo a contagem de tempo e os prazos do processo. O sobrestamento impede que um processo receba novos documentos ou alterações."
Informações Complementares,Peticionamento Eletrônico O formulário do SEI pede o código do curso. Nós devemos colocar o código da habilitação atual ou o código da segunda habilitação pretendida? ,"Com a implantação do SIGAA, esse campo não é mais necessário. A equipe da SAA está providenciando a alteração do formulário."
Informações Complementares,Peticionamento Eletrônico Como faço para entrar com recurso? ,"Para realizar o recurso, o interessado deve ingressar - por meio do processo intercorrente (peticionamento eletrônico) - preenchendo o formulário de recurso geral, no link: http://saa.unb.br/aproveitamento-de-estudos."
Informações Complementares,SIGAA (Sistema Integrado de Gestão de Atividades Acadêmicas) Como recuperar a senha de acesso ao SIGAA? ,O aluno recupera senha e acesso por meio do seguinte caminho: a) sig.unb.br; b) clicar em SIGAA; e c) clicar em esqueci a senha.
Informações Complementares,SIGAA (Sistema Integrado de Gestão de Atividades Acadêmicas) Como faço para atualizar meus dados cadastrais? ,"Alguns dados podem ser atualizados pelo próprio aluno. Caso tenha alguma dificuldade, o aluno deve entrar em contato via e-mail: saaatendimento@unb.br."
